{
  "$schema": "https://json-schema.org/draft/2020-12/schema",
  "type": "object",
  "additionalProperties": false,
  "required": [
    "schema_version",
    "skill",
    "language",
    "context",
    "sources",
    "content"
  ],
  "properties": {
    "schema_version": {
      "const": "1.0"
    },
    "skill": {
      "const": "tw-edu-pbl-designer"
    },
    "language": {
      "const": "zh-TW"
    },
    "context": {
      "type": "object",
      "additionalProperties": false,
      "required": [
        "subject",
        "grade",
        "topic"
      ],
      "properties": {
        "subject": {
          "type": "string",
          "minLength": 1
        },
        "grade": {
          "type": "string",
          "minLength": 1
        },
        "topic": {
          "type": "string",
          "minLength": 1
        }
      }
    },
    "sources": {
      "type": "array",
      "items": {
        "type": "object",
        "additionalProperties": false,
        "required": [
          "title",
          "status"
        ],
        "properties": {
          "title": {
            "type": "string",
            "minLength": 1
          },
          "url": {
            "type": "string"
          },
          "status": {
            "enum": [
              "verified",
              "user_provided",
              "pending"
            ]
          }
        }
      }
    },
    "content": {
      "type": "object",
      "additionalProperties": false,
      "required": [
        "title",
        "driving_question",
        "authentic_context",
        "milestones",
        "final_product",
        "assessment_criteria"
      ],
      "properties": {
        "title": {
          "type": "string",
          "minLength": 1
        },
        "driving_question": {
          "type": "string",
          "minLength": 1
        },
        "authentic_context": {
          "type": "string",
          "minLength": 1
        },
        "milestones": {
          "type": "array",
          "minItems": 1,
          "items": {
            "type": "object",
            "additionalProperties": false,
            "required": [
              "id",
              "deliverable",
              "due",
              "feedback"
            ],
            "properties": {
              "id": {
                "type": "string",
                "minLength": 1
              },
              "deliverable": {
                "type": "string",
                "minLength": 1
              },
              "due": {
                "type": "string",
                "minLength": 1
              },
              "feedback": {
                "type": "string",
                "minLength": 1
              }
            }
          }
        },
        "final_product": {
          "type": "string",
          "minLength": 1
        },
        "assessment_criteria": {
          "type": "array",
          "minItems": 1,
          "items": {
            "type": "string",
            "minLength": 1
          }
        }
      }
    }
  }
}
